{
  "schema_version": "1.0",
  "roadmap_version": "v0.8.6-to-v1.0.0",
  "reviewed_on": "2026-07-09",
  "allowed_statuses": [
    "PLANNED",
    "IN_PROGRESS",
    "COMPLETE",
    "BLOCKED",
    "DEFERRED"
  ],
  "required_fields": [
    "objective",
    "inputs",
    "outputs",
    "invariants",
    "failure_states",
    "success_condition",
    "stop_condition",
    "fallback_condition",
    "acceptance_tests",
    "out_of_scope"
  ],
  "contracts": [
    {
      "contract_id": "V086-C01-CONTRACTS-AND-ROADMAP",
      "milestone": "0.8.6",
      "status": "COMPLETE",
      "objective": "Ratify bounded development contracts and the vertical roadmap before further material implementation.",
      "inputs": [
        "main at v0.8.5",
        "existing methodology documents",
        "existing component registry"
      ],
      "outputs": [
        "docs/ROADMAP_V0.8.6_TO_V1.0.md",
        "docs/DEVELOPMENT_CONTRACT_STANDARD.md",
        "config/development_contracts.json",
        "docs/DECISION_LOG.md"
      ],
      "invariants": [
        "no economic methodology change",
        "research_release_allowed remains false",
        "monetary_release_allowed remains false",
        "no public/latest modification"
      ],
      "failure_states": [
        "CONTRACT_FIELD_MISSING",
        "DUPLICATE_CONTRACT_ID",
        "UNBOUNDED_SCOPE",
        "RELEASE_GATE_WEAKENED"
      ],
      "success_condition": "The contract validator and its unit tests pass and the roadmap supersedes stale next-action guidance.",
      "stop_condition": "Stop after contract, roadmap and reuse-governance files are complete; do not implement SDMX, versioning or telemetry in this pull request.",
      "fallback_condition": "If an existing file conflicts with a ratified constitutional rule, preserve the constitutional rule and record the conflict in the decision log.",
      "acceptance_tests": [
        "python scripts/validate_development_contracts.py",
        "python -m unittest discover -s tests -p test_development_contracts.py -v"
      ],
      "out_of_scope": [
        "version code changes",
        "SDMX live requests",
        "Hypothesis properties",
        "telemetry generation",
        "country adapters"
      ]
    },
    {
      "contract_id": "V086-C02-VERSION-SOURCE-OF-TRUTH",
      "milestone": "0.8.6",
      "status": "COMPLETE",
      "objective": "Make pyproject.toml the sole authored project version and fail CI on divergent generated values.",
      "inputs": [
        "pyproject.toml",
        "installed package metadata",
        "version-bearing configs and generated reports"
      ],
      "outputs": [
        "importlib.metadata version helper",
        "version consistency check",
        "CI gate"
      ],
      "invariants": [
        "no manually maintained second version constant",
        "generated reports identify the installed version",
        "release flags are unaffected"
      ],
      "failure_states": [
        "PACKAGE_NOT_INSTALLED",
        "VERSION_DIVERGENCE",
        "UNDECLARED_VERSION_LITERAL"
      ],
      "success_condition": "A clean install reports the pyproject version and CI rejects a deliberately altered config or generated version.",
      "stop_condition": "Stop after version derivation and consistency tests pass; do not bump to 0.8.6 until every v0.8.6 gate is complete.",
      "fallback_condition": "In an uninstalled source checkout, report 0+unknown only for diagnostic display and never for release artefacts.",
      "acceptance_tests": [
        "full unit suite",
        "deliberate divergence test",
        "wheel or editable-install metadata test"
      ],
      "out_of_scope": [
        "semantic version redesign",
        "release publication",
        "branch renaming"
      ]
    },
    {
      "contract_id": "V086-C03-SDMX-CLIENT-SPIKE",
      "milestone": "0.8.6",
      "status": "COMPLETE",
      "objective": "Select one SDMX client for the v0.8.7 Eurostat and OECD pilot using recorded evidence.",
      "inputs": [
        "existing armilar_prices SDMX adapter contract",
        "Eurostat official endpoint",
        "OECD official endpoint",
        "network-enabled non-PR runner"
      ],
      "outputs": [
        "spike report",
        "preserved request metadata",
        "capability matrix",
        "selected-client decision"
      ],
      "invariants": [
        "live network is excluded from PR checks",
        "raw bytes and hashes remain Armilar-controlled",
        "provider errors fail closed",
        "pysdmx is not installed without a demonstrated gap"
      ],
      "failure_states": [
        "NETWORK_BLOCKED",
        "PROVIDER_SCHEMA_UNRESOLVED",
        "RAW_BYTES_NOT_PRESERVED",
        "CLIENT_REQUIREMENT_UNMET"
      ],
      "success_condition": "sdmx1 retrieves and parses representative Eurostat and OECD responses with sufficient metadata, or a specific unmet requirement justifies a bounded pysdmx comparison.",
      "stop_condition": "Stop after the declared requirement matrix is evaluated; do not build the full v0.8.7 series.",
      "fallback_condition": "Preserve the current replay contract and classify the spike as blocked without enabling live production.",
      "acceptance_tests": [
        "existing replay tests",
        "network-disabled failure test",
        "non-PR live smoke report",
        "raw hash verification"
      ],
      "out_of_scope": [
        "country adapters",
        "production scheduling",
        "full historical acquisition",
        "API publication"
      ]
    },
    {
      "contract_id": "V086-C04-PROPERTY-TESTS",
      "milestone": "0.8.6",
      "status": "COMPLETE",
      "objective": "Use Hypothesis to test economic and mathematical invariants over generated edge cases.",
      "inputs": [
        "current deterministic engines",
        "current unit tests",
        "declared invariants"
      ],
      "outputs": [
        "test-only Hypothesis dependency",
        "property tests",
        "documented profiles suitable for CI"
      ],
      "invariants": [
        "no runtime dependency",
        "examples are reproducible on failure",
        "existing deterministic tests remain",
        "no test weakens fail-closed behaviour"
      ],
      "failure_states": [
        "FLAKY_PROPERTY",
        "UNBOUNDED_GENERATION",
        "RUNTIME_DEPENDENCY_LEAK",
        "INVARIANT_NOT_ASSERTED"
      ],
      "success_condition": "Properties cover sums, ordering, duplicate rejection, future periods, FX conventions, incomplete grids and silent-renormalisation prevention within bounded CI runtime.",
      "stop_condition": "Stop after the declared properties pass; do not add model-performance tests or new economic methods.",
      "fallback_condition": "Where a public function cannot be tested without redesign, retain deterministic cases and record the testability gap instead of refactoring broadly.",
      "acceptance_tests": [
        "full unit suite",
        "Hypothesis CI profile",
        "seeded reproduction of one deliberate failure during development"
      ],
      "out_of_scope": [
        "fuzzing external providers",
        "performance benchmarking",
        "new imputation models"
      ]
    },
    {
      "contract_id": "V086-C05-DEVELOPMENT-TELEMETRY",
      "milestone": "0.8.6",
      "status": "COMPLETE",
      "objective": "Publish reproducible codebase and pipeline telemetry without treating code volume as progress.",
      "inputs": [
        "repository tree",
        "test result",
        "pipeline outputs when available"
      ],
      "outputs": [
        "development_metrics.json",
        "CI artefact",
        "documented metric definitions"
      ],
      "invariants": [
        "generated telemetry is deterministic for a checkout",
        "generated files do not enter public/latest in PRs",
        "LOC is descriptive only",
        "missing optional pipeline outputs are explicit"
      ],
      "failure_states": [
        "METRIC_DEFINITION_AMBIGUOUS",
        "NONDETERMINISTIC_COUNT",
        "PUBLICATION_PATH_VIOLATION",
        "BASELINE_REGRESSION_UNEXPLAINED"
      ],
      "success_condition": "CI publishes production LOC, test LOC, tests, suite duration, modules, largest file, pipeline runtime, artefact count and available weight/price coverage.",
      "stop_condition": "Stop after telemetry generation and CI upload work; do not introduce an observability platform.",
      "fallback_condition": "Emit null plus an explicit reason for unavailable economic coverage metrics rather than fabricate zero.",
      "acceptance_tests": [
        "fixture repository count test",
        "determinism test",
        "CI artefact smoke check",
        "no public/latest diff"
      ],
      "out_of_scope": [
        "dashboard",
        "time-series database",
        "external monitoring service"
      ]
    },
    {
      "contract_id": "V087-C01-EUROSTAT-VERTICAL-SERIES",
      "milestone": "0.8.7",
      "status": "COMPLETE",
      "objective": "Produce the first real replayable monthly Armilar research series for a fixed Eurostat universe.",
      "inputs": [
        "selected SDMX client",
        "official Eurostat HICP responses",
        "fixed price universe",
        "Armilar weights and mappings"
      ],
      "outputs": [
        "raw receipts",
        "normalised observations",
        "monthly index",
        "contributions",
        "coverage",
        "uncertainty",
        "manifest",
        "economic report"
      ],
      "invariants": [
        "fixed universe",
        "no silent renormalisation",
        "local-price primary index",
        "common-currency layer separate",
        "release flags false"
      ],
      "failure_states": [
        "INCOMPLETE_COMMON_INTERVAL",
        "SOURCE_CONCEPT_MISMATCH",
        "REPLAY_HASH_MISMATCH",
        "UNDECLARED_FALLBACK"
      ],